{
  "id": "018f0000-0000-7000-8000-000000000021",
  "sourceId": "018f0000-0000-7000-8000-000000000001",
  "targetId": "018f0000-0000-7000-8000-000000000010",
  "type": "member_of",
  "metadata": {},
  "createdAt": "2026-05-20T00:00:00.000Z",
  "createdBy": "018f0000-0000-7000-8000-000000000001",
  "schemaVersion": "0.1.0"
}
